{
  "site": "wpafb",
  "catalog_version": "afdf4f58440fa1465e22415651ed131a299e0c69343a004aab35daaf51c0e686",
  "contract_version": "1.25.0",
  "atoms": [
    {
      "handle": "concept:wpafb:7q10",
      "kind": "concept",
      "site": "wpafb",
      "local_id": "7q10",
      "title": "7Q10",
      "feed": "concepts"
    },
    {
      "handle": "concept:wpafb:assimilative-capacity",
      "kind": "concept",
      "site": "wpafb",
      "local_id": "assimilative-capacity",
      "title": "Assimilative capacity",
      "feed": "concepts"
    },
    {
      "handle": "concept:wpafb:common-control-plumbing",
      "kind": "concept",
      "site": "wpafb",
      "local_id": "common-control-plumbing",
      "title": "Common-control plumbing",
      "feed": "concepts"
    },
    {
      "handle": "concept:wpafb:consumptive-cooling",
      "kind": "concept",
      "site": "wpafb",
      "local_id": "consumptive-cooling",
      "title": "Consumptive cooling",
      "feed": "concepts"
    },
    {
      "handle": "concept:wpafb:hyperscale-data-center",
      "kind": "concept",
      "site": "wpafb",
      "local_id": "hyperscale-data-center",
      "title": "Hyperscale data center",
      "feed": "concepts"
    },
    {
      "handle": "concept:wpafb:public-records-mandamus",
      "kind": "concept",
      "site": "wpafb",
      "local_id": "public-records-mandamus",
      "title": "Public-records mandamus",
      "feed": "concepts"
    },
    {
      "handle": "dataset:wpafb:air-emission-factors",
      "kind": "dataset",
      "site": "wpafb",
      "local_id": "air-emission-factors",
      "title": "Genset Emission Factors (EPA AP-42 §3.4)",
      "feed": "catalog"
    },
    {
      "handle": "dataset:wpafb:air-naaqs",
      "kind": "dataset",
      "site": "wpafb",
      "local_id": "air-naaqs",
      "title": "National Ambient Air Quality Standards (NAAQS)",
      "feed": "catalog"
    },
    {
      "handle": "dataset:wpafb:bundle-records",
      "kind": "dataset",
      "site": "wpafb",
      "local_id": "bundle-records",
      "title": "The published content bundle — typed feeds + manifest (watermark export)",
      "feed": "catalog"
    },
    {
      "handle": "dataset:wpafb:compute",
      "kind": "dataset",
      "site": "wpafb",
      "local_id": "compute",
      "title": "AI Accelerator & Rack-Density Compute Reference",
      "feed": "catalog"
    },
    {
      "handle": "dataset:wpafb:data-centers",
      "kind": "dataset",
      "site": "wpafb",
      "local_id": "data-centers",
      "title": "Per-Site Data-Center Activity Register",
      "feed": "catalog"
    },
    {
      "handle": "dataset:wpafb:data-centers-wpafb",
      "kind": "dataset",
      "site": "wpafb",
      "local_id": "data-centers-wpafb",
      "title": "WPAFB / Dayton (Greene + Montgomery Co.) OH — Data-Center Activity Register",
      "feed": "catalog"
    },
    {
      "handle": "dataset:wpafb:datacenter-industry",
      "kind": "dataset",
      "site": "wpafb",
      "local_id": "datacenter-industry",
      "title": "Data-Center Industry Reference Priors (Uncertainty Bands)",
      "feed": "catalog"
    },
    {
      "handle": "dataset:wpafb:echo-great-miami-wwtp",
      "kind": "dataset",
      "site": "wpafb",
      "local_id": "echo-great-miami-wwtp",
      "title": "Great Miami-basin NPDES discharger inventory (EPA ECHO)",
      "feed": "catalog"
    },
    {
      "handle": "dataset:wpafb:economics-baseline",
      "kind": "dataset",
      "site": "wpafb",
      "local_id": "economics-baseline",
      "title": "Montgomery County, OH Economic Baseline (BLS QCEW + US Census ACS)",
      "feed": "catalog"
    },
    {
      "handle": "dataset:wpafb:eia",
      "kind": "dataset",
      "site": "wpafb",
      "local_id": "eia",
      "title": "PJM Balancing-Authority Interchange Aggregates (EIA-930)",
      "feed": "catalog"
    },
    {
      "handle": "dataset:wpafb:eia-consumer-energy",
      "kind": "dataset",
      "site": "wpafb",
      "local_id": "eia-consumer-energy",
      "title": "Ohio Consumer Energy-Cost Baseline (EIA API v2)",
      "feed": "catalog"
    },
    {
      "handle": "dataset:wpafb:eia-demand-pressure",
      "kind": "dataset",
      "site": "wpafb",
      "local_id": "eia-demand-pressure",
      "title": "Facility Demand → Consumer Price-Pressure Sensitivity (EIA + facility load)",
      "feed": "catalog"
    },
    {
      "handle": "dataset:wpafb:eia-grid-profile",
      "kind": "dataset",
      "site": "wpafb",
      "local_id": "eia-grid-profile",
      "title": "Per-Site Campus Grid Profile — Serving Utility, BA & Load Share (EIA-861/930)",
      "feed": "catalog"
    },
    {
      "handle": "dataset:wpafb:federal",
      "kind": "dataset",
      "site": "wpafb",
      "local_id": "federal",
      "title": "Federal Energy-Policy & National-Output Backdrop (IRA + EIA + LBNL/DOE)",
      "feed": "catalog"
    },
    {
      "handle": "dataset:wpafb:ferc",
      "kind": "dataset",
      "site": "wpafb",
      "local_id": "ferc",
      "title": "FERC↔PUCO Regulatory Seam (Federal Power Act + FERC eLibrary)",
      "feed": "catalog"
    },
    {
      "handle": "dataset:wpafb:gleif",
      "kind": "dataset",
      "site": "wpafb",
      "local_id": "gleif",
      "title": "Corridor Entity LEIs (GLEIF)",
      "feed": "catalog"
    },
    {
      "handle": "dataset:wpafb:greenops",
      "kind": "dataset",
      "site": "wpafb",
      "local_id": "greenops",
      "title": "GreenOps — Anthropic Admin usage & cost",
      "feed": "catalog"
    },
    {
      "handle": "dataset:wpafb:greenops-aws",
      "kind": "dataset",
      "site": "wpafb",
      "local_id": "greenops-aws",
      "title": "GreenOps — AWS costs & estimated carbon",
      "feed": "catalog"
    },
    {
      "handle": "dataset:wpafb:greenops-factors",
      "kind": "dataset",
      "site": "wpafb",
      "local_id": "greenops-factors",
      "title": "GreenOps — eGRID carbon-intensity & WUE water factors",
      "feed": "catalog"
    },
    {
      "handle": "dataset:wpafb:greenops-footprint",
      "kind": "dataset",
      "site": "wpafb",
      "local_id": "greenops-footprint",
      "title": "GreenOps — derived compute footprint (usage → electricity → water)",
      "feed": "catalog"
    },
    {
      "handle": "dataset:wpafb:greenops-github",
      "kind": "dataset",
      "site": "wpafb",
      "local_id": "greenops-github",
      "title": "GreenOps — GitHub Actions minutes & storage",
      "feed": "catalog"
    },
    {
      "handle": "dataset:wpafb:grid",
      "kind": "dataset",
      "site": "wpafb",
      "local_id": "grid",
      "title": "Grid Reliability Event Extractions (PJM §202(c) backup-generation dispatch)",
      "feed": "catalog"
    },
    {
      "handle": "dataset:wpafb:hydrology-atlas14-corridor-ddf",
      "kind": "dataset",
      "site": "wpafb",
      "local_id": "hydrology-atlas14-corridor-ddf",
      "title": "NOAA Atlas-14 Corridor Design-Storm Depths (Depth-Duration-Frequency)",
      "feed": "catalog"
    },
    {
      "handle": "dataset:wpafb:hydrology-nasa-power-climatology",
      "kind": "dataset",
      "site": "wpafb",
      "local_id": "hydrology-nasa-power-climatology",
      "title": "NASA POWER Climate Normals — site climatology",
      "feed": "catalog"
    },
    {
      "handle": "dataset:wpafb:hydrology-ohio-principal-streams",
      "kind": "dataset",
      "site": "wpafb",
      "local_id": "hydrology-ohio-principal-streams",
      "title": "Ohio Principal Streams & Drainage Areas (ODNR, Sherman 1925 / 1999 reprint)",
      "feed": "catalog"
    },
    {
      "handle": "dataset:wpafb:hydrology-reaches",
      "kind": "dataset",
      "site": "wpafb",
      "local_id": "hydrology-reaches",
      "title": "Reach-network river centerlines — NHDPlus geometry (USGS NLDI)",
      "feed": "catalog"
    },
    {
      "handle": "dataset:wpafb:lsc-status-report",
      "kind": "dataset",
      "site": "wpafb",
      "local_id": "lsc-status-report",
      "title": "Ohio LSC Status Report of Legislation",
      "feed": "catalog"
    },
    {
      "handle": "dataset:wpafb:meetings",
      "kind": "dataset",
      "site": "wpafb",
      "local_id": "meetings",
      "title": "Per-Site Civic Meeting Records (Slug-Scoped)",
      "feed": "catalog"
    },
    {
      "handle": "dataset:wpafb:network",
      "kind": "dataset",
      "site": "wpafb",
      "local_id": "network",
      "title": "BOSC Watershed-Point Network Synthesis (Maumee Basin)",
      "feed": "catalog"
    },
    {
      "handle": "dataset:wpafb:odd-grants-loans",
      "kind": "dataset",
      "site": "wpafb",
      "local_id": "odd-grants-loans",
      "title": "Ohio Department of Development — Grants and Loans disbursements (statewide)",
      "feed": "catalog"
    },
    {
      "handle": "dataset:wpafb:odd-tax-incentives",
      "kind": "dataset",
      "site": "wpafb",
      "local_id": "odd-tax-incentives",
      "title": "Ohio Department of Development — Tax Incentives (JCTC/JRTC/Historic/Datacenter)",
      "feed": "catalog"
    },
    {
      "handle": "dataset:wpafb:odd-tca-minutes",
      "kind": "dataset",
      "site": "wpafb",
      "local_id": "odd-tca-minutes",
      "title": "Ohio Tax Credit Authority — meeting minutes (Jan 2025 – Mar 2026)",
      "feed": "catalog"
    },
    {
      "handle": "dataset:wpafb:odot-driveohio-cv-av",
      "kind": "dataset",
      "site": "wpafb",
      "local_id": "odot-driveohio-cv-av",
      "title": "Ohio CV/AV System Core Service Requirements (DriveOhio / AECOM)",
      "feed": "catalog"
    },
    {
      "handle": "dataset:wpafb:oepa-ohd000001-gp",
      "kind": "dataset",
      "site": "wpafb",
      "local_id": "oepa-ohd000001-gp",
      "title": "Ohio EPA Draft General NPDES Permit for Data Center Facilities (OHD000001)",
      "feed": "catalog"
    },
    {
      "handle": "dataset:wpafb:onboard-bundle",
      "kind": "dataset",
      "site": "wpafb",